title,category,content
"AI w medycynie","technology","Sztuczna inteligencja rewolucjonizuje medycynę. Algorytmy uczenia maszynowego pomagają w diagnostyce chorób. Systemy AI analizują obrazy medyczne z dokładnością przewyższającą ludzkich ekspertów. Technologia ta może znacznie poprawić jakość opieki zdrowotnej."
"Odkrycie archeologiczne","history","Archeolodzy odkryli starożytne miasto. Znaleziska obejmują ceramikę, narzędzia i ruiny budynków. Odkrycie rzuca nowe światło na historię starożytnych cywilizacji. Badania będą kontynuowane w przyszłym roku."
"Zmiany klimatyczne","environment","Globalne ocieplenie wpływa na ekosystemy. Naukowcy ostrzegają przed konsekwencjami zmian klimatycznych. Konieczne są pilne działania aby chronić naszą planetę. Redukcja emisji CO2 jest kluczowa."
"Nowa technologia transportu","technology","Pojazdy autonomiczne to przyszłość transportu. Samochody bez kierowcy będą bezpieczniejsze i bardziej efektywne. Technologia ta zmieni sposób w jaki się przemieszczamy. Pierwsze komercyjne wdrożenia już za kilka lat."
"Odkrycia w fizyce kwantowej","science","Naukowcy dokonali przełomu w fizyce kwantowej. Nowe odkrycie może zmienić nasze rozumienie rzeczywistości. Zastosowania obejmują komputery kwantowe i kryptografię. Badania są na wczesnym etapie."
"Trendy w modzie 2024","lifestyle","Moda w 2024 roku to powrót do klasyki. Dominują naturalne tkaniny i minimalizm. Zrównoważona moda zyskuje na znaczeniu. Projektanci stawiają na jakość i ponadczasowość."
"Breakthrough in renewable energy","technology","Scientists developed a new solar panel technology. The innovation is 40% more efficient than current models. This could significantly reduce the cost of solar energy. Commercialization expected within three years."
"Economic forecast 2024","business","Global economy shows signs of recovery. Inflation rates are stabilizing across major markets. Technology sector continues to lead growth. Experts predict moderate growth in the coming year."
